{
  "context_pack_id": "ctx-credit-001",
  "jurisdiction": "EU",
  "sector": "financial_services",
  "system_purpose": "Automated credit scoring for retail lending",
  "risk_class": "high-risk",
  "deployment_stage": "production",
  "affected_population": "Adult loan applicants",
  "data_modality": ["structured_tabular", "financial_history"],
  "supplier_status": "internal_development",
  "regulatory_baseline": ["EU AI Act", "ECHR"],
  "policy_baseline": ["Fair Lending Policy v2.0", "Model Risk Management Policy v3.1"],
  "version": "1.0"
}
