{
  "context_pack_id": "ctx-proc-001",
  "jurisdiction": "EU",
  "sector": "procurement",
  "system_purpose": "Third-party AI vendor due diligence and procurement",
  "risk_class": "high-risk",
  "deployment_stage": "procurement",
  "affected_population": "Procurement staff and AI vendor personnel",
  "data_modality": ["structured_documents", "text"],
  "supplier_status": "third_party_vendor",
  "regulatory_baseline": ["GDPR", "EU AI Act"],
  "policy_baseline": ["Vendor Onboarding Policy v3.0", "Third-Party Risk Management Framework v2.2"],
  "version": "1.0"
}
