{
  "context_pack_id": "ctx-recruit-001",
  "jurisdiction": "EU",
  "sector": "recruitment",
  "system_purpose": "Automated CV screening and candidate ranking chatbot",
  "risk_class": "high-risk",
  "deployment_stage": "production",
  "affected_population": "Job applicants aged 18-65",
  "data_modality": ["text", "structured_cv"],
  "supplier_status": "third_party_processor",
  "regulatory_baseline": ["GDPR", "EU AI Act"],
  "policy_baseline": ["HR Data Retention Policy v2.1", "Bias Audit Protocol v1.0"],
  "version": "1.0"
}
